Protein id	Contig id	Start	Stop	Strand	Element symbol	Element name	Scope	Type	Subtype	Class	Subclass	Method	Target length	Reference sequence length	% Coverage of reference	% Identity to reference	Alignment length	Closest reference accession	Closest reference name	HMM accession	HMM description
NA	573.13370.con.0002	239471	239887	-	fosA	FosA5 family fosfomycin resistance glutathione transferase	core	AMR	AMR	FOSFOMYCIN	FOSFOMYCIN	EXACTX	139	139	100.00	100.00	139	WP_004146118.1	FosA5 family fosfomycin resistance glutathione transferase	NA	NA
NA	573.13370.con.0003	30717	31889	+	oqxA	multidrug efflux RND transporter periplasmic adaptor subunit OqxA	core	AMR	AMR	NITROFURAN/PHENICOL/QUINOLONE/TETRACYCLINE	NITROFURANTOIN/PHENICOL/QUINOLONE/TIGECYCLINE	EXACTX	391	391	100.00	100.00	391	WP_002914189.1	multidrug efflux RND transporter periplasmic adaptor subunit OqxA	NA	NA
NA	573.13370.con.0003	31916	35065	+	oqxB	multidrug efflux RND transporter permease subunit OqxB	core	AMR	AMR	NITROFURAN/PHENICOL/QUINOLONE/TETRACYCLINE	NITROFURANTOIN/PHENICOL/QUINOLONE/TIGECYCLINE	BLASTX	1050	1050	100.00	99.90	1050	WP_021312368.1	multidrug efflux RND transporter permease subunit OqxB20	NA	NA
NA	573.13370.con.0085	521	1162	+	qnrB17	quinolone resistance pentapeptide repeat protein QnrB17	core	AMR	AMR	QUINOLONE	QUINOLONE	ALLELEX	214	214	100.00	100.00	214	WP_048216435.1	quinolone resistance pentapeptide repeat protein QnrB17	NA	NA
NA	573.13370.con.0095	163	996	-	aph(6)-Id	aminoglycoside O-phosphotransferase APH(6)-Id	core	AMR	AMR	AMINOGLYCOSIDE	STREPTOMYCIN	EXACTX	278	278	100.00	100.00	278	WP_000480968.1	aminoglycoside O-phosphotransferase APH(6)-Id	NA	NA
NA	573.13370.con.0095	999	1799	-	aph(3'')-Ib	aminoglycoside O-phosphotransferase APH(3'')-Ib	core	AMR	AMR	AMINOGLYCOSIDE	STREPTOMYCIN	EXACTX	267	267	100.00	100.00	267	WP_001082319.1	aminoglycoside O-phosphotransferase APH(3'')-Ib	NA	NA
NA	573.13370.con.0101	2	850	+	blaSHV	SHV family class A beta-lactamase	core	AMR	AMR	BETA-LACTAM	BETA-LACTAM	BLASTX	283	286	98.95	100.00	283	WP_002904004.1	extended-spectrum class A beta-lactamase SHV-12	NA	NA
NA	573.13370.con.0123	3	275	-	qacE	quaternary ammonium compound efflux SMR transporter QacE	core	STRESS	BIOCIDE	QUATERNARY AMMONIUM	QUATERNARY AMMONIUM	PARTIAL_CONTIG_ENDX	91	115	79.13	100.00	91	WP_000679427.1	quaternary ammonium compound efflux SMR transporter QacE delta 1	NA	NA
NA	573.13370.con.0123	465	959	-	dfrA22	trimethoprim-resistant dihydrofolate reductase DfrA22	core	AMR	AMR	TRIMETHOPRIM	TRIMETHOPRIM	EXACTX	165	165	100.00	100.00	165	WP_032667553.1	trimethoprim-resistant dihydrofolate reductase DfrA22	NA	NA
