Protein id	Contig id	Start	Stop	Strand	Element symbol	Element name	Scope	Type	Subtype	Class	Subclass	Method	Target length	Reference sequence length	% Coverage of reference	% Identity to reference	Alignment length	Closest reference accession	Closest reference name	HMM accession	HMM description
NA	573.20061.con.0001	880550	881722	+	oqxA	multidrug efflux RND transporter periplasmic adaptor subunit OqxA	core	AMR	AMR	NITROFURAN/PHENICOL/QUINOLONE/TETRACYCLINE	NITROFURANTOIN/PHENICOL/QUINOLONE/TIGECYCLINE	BLASTX	391	391	100.00	99.74	391	WP_002914189.1	multidrug efflux RND transporter periplasmic adaptor subunit OqxA	NA	NA
NA	573.20061.con.0001	881749	884898	+	oqxB5	multidrug efflux RND transporter permease subunit OqxB5	core	AMR	AMR	PHENICOL/QUINOLONE	PHENICOL/QUINOLONE	ALLELEX	1050	1050	100.00	100.00	1050	WP_004174783.1	multidrug efflux RND transporter permease subunit OqxB5	NA	NA
NA	573.20061.con.0001	2754624	2755040	+	fosA5	fosfomycin resistance glutathione transferase FosA5	core	AMR	AMR	FOSFOMYCIN	FOSFOMYCIN	ALLELEX	139	139	100.00	100.00	139	WP_012579083.1	fosfomycin resistance glutathione transferase FosA5	NA	NA
NA	573.20061.con.0001	4680802	4681659	-	blaSHV-11	broad-spectrum class A beta-lactamase SHV-11	core	AMR	AMR	BETA-LACTAM	BETA-LACTAM	ALLELEX	286	286	100.00	100.00	286	WP_004176269.1	broad-spectrum class A beta-lactamase SHV-11	NA	NA
NA	573.20061.con.0003	15975	16769	+	blaOXA-48	OXA-48 family carbapenem-hydrolyzing class D beta-lactamase OXA-48	core	AMR	AMR	BETA-LACTAM	CARBAPENEM	ALLELEX	265	265	100.00	100.00	265	WP_015059991.1	OXA-48 family carbapenem-hydrolyzing class D beta-lactamase OXA-48	NA	NA
